stock_id,name,產業,新聞
2313,華通,華通主要從事印刷電路板(PCB)的生產，隨著AI及衛星技術的發展，市場需求增加。公司在PCB產業中扮演重要角色，特別是在高科技應用領域。,華通5月營收達67.62億元，創下五年新高。公司計劃發行現增股4.2萬張以籌資84億元，並且法人已調升其獲利預估及目標價。
2449,京元電子,京元電子主要從事半導體封裝測試服務，屬於電子零組件產業。隨著全球對於高效能計算和5G技術的需求增加，半導體產業增加，京元電子在此趨勢中扮演著關鍵的供應鏈角色，提供客戶高品質的封裝解決方案。,京元電子在5月的營收達到37.77億元，反映其營運數據維持。
3645,達邁,達邁主要提供PI半導體材料，屬於半導體材料產業。隨著市場對高性能材料需求的增加，該公司正加強其產能以應對市場需求，並持續提升營運表現。,達邁近期宣布PI半導體材料的產能將擴大，全年營運表現持續向好。
3665,貿聯-KY,貿聯-KY主要提供AI伺服器及相關資料中心連接技術，專注於光傳輸及高速傳輸解決方案。隨著AI及資料中心需求增長，該公司在供應鏈中扮演關鍵角色，特別是在資料通訊業務的併購與擴張上。,貿聯-KY宣布以8.5億美元收購Interplex Datacom，強化其在AI資料中心的布局。此次收購有望提升其AI關鍵產品供貨能力，並進一步擴充產能以應對光傳輸需求的爆發。
6691,洋基工程,洋基工程主要提供體育相關服務，特別是在籃球領域。近期公司在5月的營收達到38億元，創下單月新高，反映穩健的市場需求。公司在PLG聯盟中扮演重要角色，並持續吸引關注。,洋基工程在近期宣布更換總教練，前德甲年度最佳教練馬修斯接任，取代李逸驊。這一人事變動發生在球隊成軍首季表現不佳的背景下，並引起廣泛討論。
6805,富世達,富世達主要從事印刷電路板（PCB）的設計與製造，屬於電子零組件產業。該公司在PCB市場中定位為提供高品質產品，並隨著電子產品需求增長，市場趨勢朝向高密度互連（HDI）及多層板發展。,富世達在第二季營收持平，預期下半年將重返成長。
7717,萊德光電-KY,萊德光電-KY專注於太空經濟領域，提供與衛星雷射連結及AI資料中心相關的技術與服務。隨著太空經濟的成長，該公司正積極佈局，並瞄準AI資料中心與太空發電的商機，顯示其在新興市場中的供應鏈角色。,萊德光電-KY近期客戶驗證成功，預期全年營收將增加，下半年表現更為增加。公司也在太空經濟的成長中啟動四階段佈局，並關注AI資料中心的需求。
8996,高力,高力主要提供燃料電池及散熱產品，隨著AI伺服器需求增長及氫能市場發展，液冷散熱技術成為其成長主軸。公司在熱能事業的比重逐漸上升，反映其在相關產業中的重要角色。,高力5月營收連續16個月年增，法人預測今年獲利將大幅成長，EPS年增率可達175%以上。公司液冷散熱產品放量，並獲得AI伺服器及氫能相關訂單，反映其活躍度。
